"","X","Full.text","Year","Publication"
"15175",15175," Q.: Why am I so sleepy and drowsy after lunch? It makes it hard to concentrate. A.: There are three likely explanations, based on recent research. First, what do you eat -- and drink? A lunch high in carbohydrates, especially if no protein is eaten along with bread and milk, is likely to produce calm to the point of sleepiness, because of the complex role of carbohydrates in shifting the balance of neurotransmitters in the brain. Conversely, some protein contributes to alertness. A three-martini lunch also induces sleepiness. Second, as siesta-loving societies have long recognized, sleep researchers have found that there is an inborn readiness in human beings to take a midafternoon nap. Volunteers isolated from all evidence of day and night and left to set their own sleep patterns tended to settle into one long sleep session and a session of 1 or 2 hours about 12 hours after the middle of the main period. Third, you may be sleep-deprived. While the average adult needs eight to nine hours of sleep a night, most get only seven, and many get six or less during the workweek. People permitted to sleep as much as they choose sleep 10.3 hours out of every 24, just as monkeys and apes do. An afternoon nap may be just what nature ordered to restore alertness. C. CLAIBORNE RAY Readers are invited to submit questions by mail to Question, Science Times, The New York Times, 229 West 43rd Street, New York, N.Y. 10036-3959, or by e-mail to question@nytimes.com.Questions of general interest will be answered in this column, but unpublished letters cannot be answered individually.  Illustration Drawing (Victoria Roberts) ",2000,"New York Times, Late Edition (East Coast); New York, N.Y."
"23343",23343," THE FACTS Poor sleep and advancing age go hand in hand - at least, that is the conventional wisdom. But growing research suggests that getting older may not necessarily mean getting less sleep. Scientists suspect that sleep problems in many older Americans may be a symptom of underlying illness, not simply aging. In a study published this month in the journal Sleep, researchers at the University of Pennsylvania looked at nearly 156,000 people, focusing on how well they slept at night and how often they experienced fatigue. The researchers found that poor general health and depression were linked to sleep disturbances and tiredness. Looking at reports of sleep problems across all ages, the researchers also found a slight increase in sleep disturbances during middle age. But over all, most people reported fewer sleep problems as they grew older, and 80-year-old people had fewer complaints than those who were 50. Another study last year showed that older people had a better ability to withstand the effects of sleep deprivation. And a large analysis of studies involving people of all ages found that most changes in sleep patterns occured between the ages of 20 and 60, and that healthy older people did not have more trouble falling asleep than younger counterparts. Those who do experience sleep problems, the study's authors said, may be showing signs of illness or side effects of medication, and should talk to a doctor. THE BOTTOM LINE In healthy adults, sleep does not necessarily get worse with age. scitimes@nytimes.comnThis is a more complete version of the story than the one that appeared in print. Illustration Drawing (Drawing by Christoph Niemann) ",2012,"New York Times, Late Edition (East Coast); New York, N.Y."
"25698",25698," Baseball is a game of numbers. But the most important number this season is not Ryan Zimmerman's .347 batting average, Aaron Judge's 24 home runs or Clayton Kershaw's 10 wins and 2.61 earned-run average as of Tuesday. The most important number in baseball for the 2017 season is 3:08. That's three hours and eight minutes, the average time it takes to play a Major League Baseball (MLB) game, according to Baseball-Reference.com. It's an important number because it is way too slow. In fact, MLB games are being played at the slowest pace in history. In 2000, the average game was 3:01 - not that big a difference. But in 1980, the average game was finished in two hours and 38 minutes. These numbers are important because baseball is losing fans, and especially young fans, to faster games such as basketball, soccer and lacrosse. So what can MLB do to speed things up? Here are some ideas. Stay in the box: Too many players step out of the batter's box after every pitch to adjust their batting gloves and take practice swings. Years ago, there was a player named Mike Hargrove, who adjusted his gloves so often they called him ""the Human Rain Delay."" Now, almost every player is like Mike Hargrove. The rule should be: Stay in the batter's box. Stop fiddling around, and play ball. Fewer meetings: It seems that every inning is interrupted with meetings on the pitcher's mound. Catchers, infielders, pitching coaches and managers come out to talk. Meetings are often boring, but they are really boring in baseball. I think the rules should limit meetings on the mound to one an inning. If you want to talk with the pitcher or another player, yell or use signals. Signals are cool. They are baseball's secret language. Instant-replay review: I don't like instant-replay review because it sends the message to kids that every call has to be perfect for the game to be fair. Sometimes there are going to be bad calls. It's good to learn to ignore them and keep playing hard. If we are going to have replay review, at least speed it up. If the manager thinks the call was wrong, he should protest right away - within 10 seconds. That would cut down on the number of protests because a manager who challenges and is wrong gets no more challenges in a regular-season game. Pitching changes: Some have suggested that MLB make rules to limit the number of pitchers who can pitch in an inning. Or have a clock so pitchers must throw a pitch within 20 seconds. These are pretty radical suggestions. But MLB has to do something because 3:08 is a bad number for baseball. kidspost@washpost.com Bowen writes the sports opinion column for KidsPost. He is the author of 22 kids sports books, including nine baseball books. ",2017,"The Washington Post; Washington, D.C."
"10822",10822," 愼㸰 Glaxo Inc., the pharmaceutical company, has amassed the following tidbits about how people sleep: * Individuals spend one-third of their lives asleep--about 220,000 hours in an average lifetime. * Newborns sleep around 16-18 hours a day, in spans of two to four hours. Teenagers generally require more than nine hours of sleep to remain alert. * The average sleeper moves 30 times in eight hours. * In older age, people tend to sleep less during the night and doze off during the day. Contrary to common belief, the need for sleep does not decrease with age--the elderly find that their sleep just becomes more fitful. * On average, working mothers with children sleep five percent less each night than their husbands. * It takes 10-15 minutes for well-rested people to fall asleep. * Couples who share a bed sleep less deeply. * More than 40,000,000 Americans snore. Loud snoring measures 80 decibels, equivalent to the sound of a jackhammer. Men are nine times more likely to snore than women. * Eight out of 10 asthma sufferers with nighttime symptoms awake an average of three nights per week. Those who experience symptoms of nocturnal asthma wake up an average of twice a night, and more than half stay awake 30 minutes at a time. * In a study conducted by the Sleep Disorders Center at Stanford University's Medical School, more than half of all shift workers surveyed admit that they fall asleep at work on a regular basis. * Charles Dickens would sleep only in a bed that was aligned on a north-south axis. * Benjamin Franklin slept in two beds each night, moving to the second when the first became too warm for him. * During World War II, British Prime Minister Winston Churchill stayed rested and alert by scheduling cabinet meetings around his naps. * During the final 48 hours of his 1992 run for the presidency, Bill Clinton campaigned through 14 cities and 5,000 miles without sleep. ",1995,"USA Today; Farmingdale"
"15032",15032," 愼㸰 Adults who say it takes them more than 30 minutes to fall asleep at night: Never 30% 1-2 times per week 32% 3 or more times per week 38% Illustration GRAPHIC, B/W, Cindy Hall and Elizabeth Wing, USA TODAY, Source: National Sleep Foundation (PIE CHART) ",2000,"USA TODAY; McLean, Va."
"14596",14596," Americans are sleeping less to cram in more work and play, a self- defeating cycle that leaves half the work force complaining that drowsiness interferes with their job, researchers said Tuesday. The National Sleep Foundation said adults of all ages get less than the recommended eight hours of sleep a night, putting themselves at risk of auto accidents and, over the longer-term, greater risk of diseases such as high blood pressure and diabetes. The foundation released its ""Sleep in America"" poll that found a third of adults slept only 6.5 hours a night during the work week. People got more sleep on weekends but still not eight hours. The poll of 1,154 adults found 45 percent of respondents will sleep less in order to get more work done. Surfing the Internet and watching television are also seen as prime contributors to the lack of sleep. Those activities were blamed by 43 percent for staying up late. ""Sleep is viewed as expendable,"" said James Walsh, a vice president of the foundation and executive director of St. Luke's Hospital Sleep Medicine/Research Center, in Chesterfield, Missouri. ""The people who stay up to work, they work more, but it's probably the same people who complain they can't concentrate the next day,"" Walsh said at a press conference. Fifty-one percent said sleepiness on the job interferes with the amount of work they get done and nearly one in five adults reported making work errors due to drowsiness. National Transportation Safety Board Chairman Jim Hall said sleep problems permeated society. He said operator fatigue had been on the agency's priority list of safety improvements for over a decade. ""Human fatigue is one of the most endemic safety issues in our society,"" said Hall, who recounted the death of a friend's son when he fell asleep at the wheel of his pickup truck. Half of the poll's respondents admitted to driving while drowsy. Among 18 to 29-year-olds, 24 percent reported falling asleep at the wheel at some point during the past year. ",2000,"Chicago Tribune; Chicago, Ill."
"20950",20950," If you feel like you're dragging at work, try grabbing a pillow instead of gulping down a latte. Catching some Z's at the office might seem like the worst thing to do when you're behind, but napping can improve productivity, according to sleep scientist Sara Mednick, a professor at the University of California-San Diego and author of ""Take a Nap! Change Your Life."" That daily 20-minute run to the coffeehouse would be better spent either catching up on missed sleep or supplementing the eight hours you got the night before. Research shows performance on memory tasks improves more following a nap than after a dose of caffeine, which provides only a short-term buzz, Mednick said. ""Most people are not sleeping well,"" she said. ""The average is about 6.7 hours a night."" Well-rested employees get along better with co-workers and feel more energized at the day's end, plus sleep better at night, Mednick said. But don't count too many sheep while you're on the clock. After about half an hour you'll fall into a deep sleep that will leave you groggy when you wake up. Credit: Associated Press ",2007,"Chicago Tribune; Chicago, Ill."
"11825",11825," Sleep Thieves: An Eye-Opening Exploration Into the Science and Mysteries of Sleep By Stanley Coren Free Press, 303 pages, $24 The Enchanted World of Sleep By Pertz Lavie, translated by Anthony Berris Yale University Press, 270 pages, $27.50 They say we know more about the moons of Jupiter than we do about the ocean depths; surely for most of us the depths of sleep are equally remote. Scientists know much about sleep, but unlike, say, the facts of exercise or nutrition, the facts have not reached the laity. This was apparent from a reading of these two fascinating books, which explain the state of the art in sleep research and its implications for everyday life. Stanley Coren's is more accessible and brightly written, although Pertz Lavie is a fine writer as well, and he gives considerable detail from his own research, including many charts and graphs. A professor of psychology at the University of British Columbia, Coren enumerates the things that rob us of sleep and describes the serious consequences. The first thief is our Western cultural disapproval of sleep, what Coren calls ""Edison's Curse"": We, along with the inventor of the lightbulb, regard sleep as time wasted and admire anyone who gets by with less than we do, and we constantly try to fit more activity into our day by truncating our sleeping hours. But if we need 7 1/2 hours of sleep a night and we get only 6, a sleep debt builds up that, over several days, makes us depressed, forgetful, inefficient, accident-prone and downright stupid. Fortunately, we can make up sleep debt in one or two nights, and many adults do that on weekends, but sleep-deprived teenagers tend to sleep even less on weekends. Teens indeed are as severely affected by sleep debt as adults, and much failure in school, Coren writes, is because of sleep deprivation or a mismatch between school hours and the sleep-clocks of individual kids. Puberty often brings, for a few years at least, a night-owl cycle where one is brightest and sharpest at night and unable to function in early morning. But the high school bus comes at 7. It is not boredom or the droning engine that makes us drowsy while driving; it's sleep debt. Here Coren cites research by Lavie (head of the Sleep Laboratory at the Technion-Israel Institute of Technology in Haifa, Israel) and others that shows most people have two periods of strongest sleep-need per day: in the predawn hours and the late afternoon. Natural sleepiness at these times is made worse by sleep debt. In ""The Enchanted World of Sleep,"" Lavie reports his findings that from 1984 to 1989 in Israel, accidents caused by falling asleep at the wheel peaked between 3 and 6 a.m. and 3 and 6 p.m. Other perhaps surprising facts from ""Sleep Thieves"": It can take as many as six hours to clear sleep-inhibiting caffeine from the body. Alcohol makes you drowsy and helps you fall asleep, but it impairs rapid-eye-movement sleep later in the night, often depriving you of real rest. The same is true of strenuous exercise in the evening hours. Uncomfortable conditions (too much light, a too-soft or too-hard mattress) or even minor interruptions can be the equivalent of lost hours. ",1996,"Chicago Tribune (pre-1997 Fulltext); Chicago, Ill."
"16015",16015," If you're like most people who don't get enough sleep during the week, you used the luxury of an extra 60 minutes Sunday for catching zzz's. For some people, sleep is sacrificed when lives are crammed with activity. If you've been feeling tired and less energetic playing your sport or exercising, look at the amount and quality of sleep you're getting. Think of sleep as the time your body needs to make repairs -- you let the engine literally cool down. Athletic trainers recognize this. Any training plan should include recovery, says a report from the American College of Sports Medicine. Athletes in training need at least six to eight hours of deep sleep every night. Sleep deficits can significantly impede training. You might feel less energetic, sluggish, tired, cranky, less able to concentrate or focus. Sleep deficit can be a one-time occurrence -- getting five hours instead of your usual eight. You can accumulate sleep deficit -- when you get only six or seven hours on weeknights instead of the eight or nine your body and mind want. The amount of sleep an athlete needs is personal -- it varies from one person to the next. Remember that just because you need eight or more hours doesn't mean you're weaker than the person who functions on six. The quality of your sleep also is important. The kind that rejuvenates the body often occurs in the later stages of sleep -- called deep sleep and R.E.M. (rapid eye movement) sleep, Dr. Gary Zammit writes in ""Good Nights"" (Andrews and McMeel, $22.95). Sleep occurs in a cycle that repeats throughout the night. You go from light sleep to deep and R.E.M. sleep and then start over with light sleep. But you may not get enough deep and R.E.M. sleep because something interrupts your sleep -- though not enough to wake you. That interruption can be caused by snoring, sudden noises, a sleep disorder called sleep apnea, pain and many other things. If you're getting adequate amounts but not sleeping deeply enough, your body may not be getting enough repair time. How can you tell if you've had sufficient quality sleep? You awake feeling rested and rejuvenated, and sustain this feeling throughout your waking hours. Sometimes your ability to fall asleep is affected by when you exercise. Physicians specializing in sleep disorders suggest not exercising vigorously or playing sports less than three hours before you go to sleep. Light stretching and breathing exercises are OK. Most people who work out close to bedtime may experience difficulty nodding off and staying asleep because exercise can increase feelings of alertness. On the other hand, others are able to sleep without trouble after a workout. Liddane is an American Council on Exercise-certified group fitness instructor. Contact her at (714) 796-7854 or lliddane@ocregister.com. Credit: By The Orange County Register ",2001,"Orange County Register; Santa Ana, Calif."
"22572",22572," ""Celebrity Autobiography,"" a popular comedy show with a rotating cast of performers who read directly from works by famous people, involves a simple setup: mainly microphones and a chair or two. ""I feel like a monkey could do it,"" jokes Rachel Dratch, a ""Saturday Night Live"" alum and frequent performer. The cabaret-style show runs usually once a month in a 135-seat New York theater. It will soon tour Chicago, Pittsburgh, Austin, Texas, and Los Angeles, where it started a decade ago, says the show's creator, Eugene Pack. Mr. Pack calls the show ""found comedy,"" humor mined from celebrities' (or ghostwriters') own words. Stars' life philosophies have a way of sounding absurd in the presence of a crowd with a two-drink minimum. The readings also find a joke in the pairing of performer with material. For instance, former TV host Dick Cavett recently delivered a deadpan reading from a Jonas Brothers tour book. Mr. Pack says the show is meant to be fun, not mockery. He estimates he has culled through nearly 300 books to come up with the roughly 100 now in rotation, including material from Ivana Trump, Madonna and Burt Reynolds. Performers have included actors Rita Wilson, Kristen Wiig and Ryan Reynolds. On a recent evening, Megan Mullally, of ""Will & Grace,"" read with daffy sincerity from Zsa Zsa Gabor's 1991 memoir, ""One Lifetime Is Not Enough."" Ms. Mullally started with Ms. Gabor's description of her 72 hours in prison after her arrest for slapping a police officer: ""I realize that, for the first time since I am a child, I -- who normally sleep naked except for diamond earrings -- am not wearing them."" To craft a cohesive stage piece, Mr. Pack may pull lines from different parts of a memoir. (Books by today's media-savvy stars can be more challenging to adapt than the self-serious ones from the past.) Mr. Pack says no celebrity has ever complained to him about being used in the show, and he knows of only one author, ""Star Trek"" actor George Takei, who has attended a performance. Mr. Takei says he didn't write the passage about running naked from the shower to take a life-changing call from his agent for laughs, but so be it. ""I enjoy a good giggle now and then,"" he says, ""even if it was at my cost."" Credit: By Ellen Gamerman ",2010,"Wall Street Journal, Eastern edition; New York, N.Y."
"8952",8952," So that high-schooler of yours has to be blasted out of bed, doesn't seem awake even when up and sleepwalks out the door? It's not just a symptom of back-to-school season. ""It's worse than that,"" says Richard P. Allen, co-director of the Johns Hopkins Sleep Disorders Clinic. ""Many never get over it."" Between December and March, Allen conducted four surveys involving more than 300 students at five Baltimore-area high schools to study sleep patterns and their impact on academic performance. ""Our research showed a correlation between less sleep in the school week and poorer grades,"" he says. ""The average night's sleep on weekdays was seven hours and on the weekends nine hours,"" the clinical psychologist says. ""Seven hours is much too little sleep for this age. Adolescents need nine to 9 1/2 hours a night."" Less than that amounts to sleep deprivation, ""not a trivial thing."" But say your sleepwalkers make it to school. What then? ""They could be sleepy until 10 or 11 in the morning,"" Allen says. ""That means the first two or three periods. They're not waking up fully until about time for lunch."" So what's a parent to do? ""On weekends, get the kids to bed as early as possible, no later than 1 a.m., to help in adjusting to the school week,"" Allen says. ""That's not too much to ask."" ",1993,"Los Angeles Times (pre-1997 Fulltext); Los Angeles, Calif."
