"","X","Full.text","Year","Publication"
"12828",12828," 愼㸰 Adult Americans average less than seven hours of sleep a night during the week, even though experts say that most people need eight hours to function at their best. And many folks try to make up for their shortage of shut-eye by sleeping in or napping on the weekends, says a poll out today, confirming a similar poll done in 1995. The National Sleep Foundation, a nonprofit group, commissioned the new survey of 1,027 adults and found: The average adult gets six hours and 57 minutes of sleep a night during the workweek and seven hours and 31 minutes a night on weekends. Men and women report about the same amount of sleep. 38% take at least one nap on the weekends, and 38% say they took a nap during the past two workweeks. The average length of naps is a little over an hour. Experts say the body has a biological need for a certain amount of sleep. If you don't get enough, you eventually have to catch up. ""How many hours you sleep on the weekend is a very good indicator of how much sleep debt you have,"" says Thomas Roth, head of the sleep medicine division, Henry Ford Hospital, Detroit. Young children -- ages 4, 5 and 6 -- usually get enough sleep during the week, so they don't build up a sleep debt. They get up at the same time on weekends, which parents view as getting up too early, Roth says. Other findings from the poll: 51% of men and 42% of women say they would go to sleep earlier if they didn't have a television or access to the Internet. 43% say they are affected a few nights a week or more by at least one symptom of insomnia. For instance, they have difficulty falling or staying asleep. 6% of women and 2% of men report that a doctor has told them they suffer from insomnia. (Researchers estimate that about 10% of the population actually has chronic insomnia or inadequate sleep or poor-quality sleep nightly for a month or more.) 43% report that they snore a few nights a week or more. Of those who snore, 16% say they snore so loudly they can be heard through a closed door, which might be a sign of a sleep disorder. 37% report being so sleepy during the day that it interferes with daily activities. 52% of shift workers (night or evening), compared with 33% of regular day workers, suffer from daytime sleepiness. 66% of men and 49% of women have driven while feeling drowsy, and 23% say they've fallen asleep at the wheel in the past year. 42% incorrectly believe that older people need fewer hours of sleep. Sleep needs remain unchanged as we age. 71% believe the body can successfully adjust to night shift work, but experts say the body never really adjusts because an internal biological clock governs when we are sleepy and alert. That clock is regulated by light and darkness. The survey has a margin of error of plus or minus 3 percentage points. The National Sleep Foundation is sponsoring National Sleep Day on April 2. Sleep specialists across the country will be offering brief, nondiagnostic consultations on sleep that day. For more information about a sleep consultation site in your area, check the foundation's Web site at www.sleepfoundation.org. Illustration GRAPHIC,b/w(Illustration) ",1998,"USA TODAY; McLean, Va."
"15381",15381," One-third of adults got less than six and a half hours of sleep a day during the workweek last year, far below the eight hours recommended by experts, according to the National Sleep Foundation. And --surprise -- one-third of adults suffered from significant daytime drowsiness. Shift workers, who do not work regular day hours, reported getting significantly less sleep during the week than the general population. Occupations that most often involve shift work, according to the Bureau of Labor Statistics, include protective services, like police and firefighters, food service, health care, trucking and transportation. A large share of teachers, nurses and accountants reported losing sleep because of job worries, according to a survey on American sleep habits taken by the furniture retailer Ikea. In addition to job stress, teachers may have trouble sleeping because long summer and holiday breaks tend to wreak havoc with their natural sleep patterns, while nurses may lose sleep because of rotating shift schedules, said Joyce A. Walsleben, director of New York University's Sleep Disorder Center. What can workers do to get more rest? Regular 20 minute naps in the afternoon would be a good start, advises Ms. Walsleben. And employers could help by creating more nap rooms; only 16 percent of workers were allowed to snooze at work last year. KATHLEEN O'BRIEN Graph ''PROFESSIONALS REPORTING LOST SLEEP BECAUSE OF JOB WORRIES'' Teachers: 95% Nurses: 81 Accountants: 77 Reporters: 66 All respondents: 38 Public relations workers: 8 Stock brokers: 7 Lawyers: 5 FIGURES ON AMERICAN SLEEP HABITS AND WORK: 49% of shift workers average less than 6.5 hours of sleep a night during the workweek. 33% of adults average less than 6.5 hours of sleep a night during the workweek. 33% of adults said they would take naps at work if it were allowed. 32% of adults suffer from significant daytime sleepiness. 19% of adults said they make frequent or occasional errors at work due to sleepiness. 16% of adults are allowed to take naps at work. (Sources: National Sleep Foundation ""2000 Omnibus Sleep in America"" poll; Ikea ''Sleep Well'' survey) ",2001,"New York Times, Late Edition (East Coast); New York, N.Y."
"16368",16368," 愼㸰 A better Life; Health, education & science Not getting enough sleep makes people short-tempered and more prone to mistakes, according to a poll of 1,010 people out today from the National Sleep Foundation. The poll also showed that in the days following the Sept. 11 terrorist attacks, sleeplessness soared across the country. Sleep researchers have long emphasized the importance of getting enough shut-eye for health and safety, and some cutting-edge research indicates that not getting enough sleep may promote weight gain, at least in the short term. Now this poll indicates sleep is crucial to good mood. Among the findings: * 64% say that when they do not get enough sleep, they are more likely to get irritated by annoyances such as waiting in line, sitting in a traffic jam or waiting for others who are late for an event or meeting. * 59% say lack of sleep makes them more likely to get upset with children who are noisy or misbehaving. * 62% say they find it harder to make decisions and to listen carefully enough to remember what is said. * 24% say they eat more than usual on days when they haven't had enough sleep. ""If you're sleepy, you are more dissatisfied with life, a little more angry, a little less likely to say you feel relaxed as opposed to tense. You are more likely to say you're sad or pessimistic,"" says James Walsh, president of the National Sleep Foundation and executive director of the Sleep Medicine and Research Center at St. Luke's Hospital in Chesterfield, Mo. Other findings: * In general, 58% say they experience at least one symptom of insomnia at least a few nights a week. Those symptoms might include difficulty falling asleep, waking a lot during the night, waking up too early and not being able to get back to sleep, and waking up unrefreshed. But after Sept. 11, 69% experienced symptoms of insomnia at least a few nights a week. * 27% rate their sleep as fair or poor on a typical night; after the attacks, 47% rated their sleep fair or poor. Most people need between 7 and 8.5 hours of sleep a night to be refreshed, wide-awake and energetic during the daytime, Walsh says. But 24% say they get less than the minimum amount of sleep they need to avoid feeling sleepy the next day; 29% say they get the minimum amount needed; and 43% say they get the amount needed to avoid sleepiness the next day. Respondents slept an average of 6.9 hours a night on weeknights, and 7.5 hours a night on weekends. The poll has a margin of error of plus or minus 3 percentage points. Illustration GRAPHIC, B/W, Julie Snider, USA TODAY, Source: Poll of 1,010 adults from the National Sleep Foundation (BAR GRAPH) ",2002,"USA TODAY; McLean, Va."
"15961",15961," Back to school means resetting biological clocks to ensure sufficient sleep every night and a healthier, safer and more productive school year. The following tips come from the National Sleep Foundation and Gaylord Hospital in Wallingford, Conn.: Establish a regular bedtime and wakeup time. This schedule should be maintained on the weekends, though students can be permitted to sleep in one or two hours on weekend mornings if necessary. While individual sleep needs can vary, sleep experts recommend that elementary school students get 10 to 11 hours of shut-eye a night. Middle-school or junior-high students need 9 to 11 hours a night, and high school students need at least 8 hours of sleep a night. Remember to add 10 to 20 minutes to bedtime for falling asleep. For other sleep-related tips, visit the Web site of the National Sleep Foundation at www.sleepfoundation.org or Gaylord Hospital at www.gaylord.org/Pages/sleep.html. ",2001,"Chicago Tribune; Chicago, Ill."
"16290",16290," 愼㸰 Here is some advice for staying alert long after April 7, the day clocks spring forward one hour and most Americans lose an hour of sleep. ""if you're young, sleep an hour later on Sunday; if you're older, go to bed an hour early,"" suggests William C. Dement, director of Stanford (Calif.) University's Sleep Disorders Center and professor of psychiatry and behavioral sciences. He is quick to point out that, for the 60,000,000 Americans who suffer from sleep debt, daylight-saving time isn't the culprit. ""If you're well rested, losing that one hour of sleep when daylight-saving time begins won't make a major difference. Don't worry about it,"" he maintains. However, most people incur a sleep debt because they don't get enough sleep over time, Dement says. ""A debt builds up if you sleep less than your personal need-from six to 10 hours a day, depending on individual variation-over the course of many nights. The good news is that you can repay the debt without interest. Someone who needs 10 hours of sleep could pay back a 10-hour debt over 10 days by sleeping one extra hour each night. You can catch up faster-for example, repaying six hours by sleeping 15 hours-though only actual sleep counts. Lying in bed and staring at the ceiling won't help repay the debt. 'To make the most of the time in bed, we recommend that older people go to bed early to pay back their debt or to make up for the hour on daylight-saving time. On the other hand, young people usually find it easier to sleep in later,"" Dement indicates. The reasons for the generation gap aren't clear, but research indicates that older people may react differently to darkness and light. 'The biological clock of older people tends to become set so that they feel sleepy sooner after dark than younger people,"" he suggests. Dement emphasizes that a single good night of sleep won't do much to help a seriously sleep-deprived person. A study conducted with long-distance truck drivers in the mid 1990s under simulated conditions showed that those who were seriously sleep-deprived were prone to doze off while driving even if they had eight hours of sleep three nights in succession before a long driving assignment. ""Their overall debt was too large to overcome in three nights."" How do you know when the debt is repaid? ""You'll feel it, Dement explains. ""You'll regain alertness and the feeling that extra sleep just won't make any difference anymore."" ",2002,"USA Today; Farmingdale"
"12708",12708," 愼㸰 Every Tuesday: Discoveries, breakthroughs and trends; See related stories: 06D One key to a good night's sleep, some researchers believe, is REM, or rapid eye movement sleep. REM sleep also is called paradoxial sleep because the brain is very active and more suggestive of being awake than being asleep, says sleep expert James Maas. During REM, when dreaming is most likely to occur, there is evidence that the brain stores some types of memory and learning. If you sleep a full eight hours, you have the best chance of getting four or five REM periods during the night. REM sleep occurs about every 90 minutes. As the night progresses, the REM periods get longer. The first REM period lasts about nine minutes; the second one, 20 minutes. The third period is about half an hour; the fourth, anywhere from one to two hours. To reach that long REM period, a person must sleep at least six to 61/2 hours a night, Maas says. Many researchers think it's the total length of time that matters, but Maas thinks that REM may make a big difference. ""We don't have conclusive evidence at this point, but it is probable that missing that long, last REM period can have detrimental effects on everything from daytime alertness to memory, concentration and even reaction time,"" he says. Illustration PHOTO, B/W, Jim Sanchez, Ithaca Journal, for USA TODAY ",1998,"USA TODAY; McLean, Va."
"15059",15059," Wake up, Orange County! We doze at the wheel. We feel drowsy at meetings or school lectures. We lack the Energizer Bunny pep. We can't concentrate without that jolt of java. Sunday is the end of daylight-saving time, the perfect opportunity for the sleep-deprived to get back on track, experts say. Enjoying that hour of sleep we ""gain"" when we set our clocks back 60 minutes can be the beginning of slumber overhaul, said Dr. Paul Selecky, medical director of the Sleep Disorders Center at Hoag Memorial Hospital Presbyterian in Newport Beach. But we need to follow through with concrete changes in how we approach slumber to truly overcome sleep debt. Lily Chao will be among those who are looking forward to the extra hour of shut-eye. Most mornings when most of us are still in dreamland, Chao, 33, is awake at 4 a.m. An hour later, she opens the doors of Donut Star in West Irvine where she is a sales manager. She tries to get to sleep by 9 p.m. But once or twice a week, Chao won't climb into bed until 11 p.m. because she has chores at home or is taking care of her 3-month-old daughter. On days when she is sleep-deprived, she naps for an hour, maybe two, when she can get it in the afternoon. ""I sleep in ev ery chance that I get."" That chance doesn't happen often enough, she said. She pays a price for sleeping in, though -- it's tough getting up the next morning when she returns to her 4 a.m. routine. Why is it so tough? Because the body clock has to constantly adjust and adapt when we change our sleeping patterns, Selecky said. And while most Americans' popular habit of sleeping in on weekends may seem like a temporary solution, it does not address the real problem -- the need to adopt consistent and solid sleeping habits, he said. To understand and change our sleep habits, we need to look at our attitudes toward sleep, he said. Here are our problems: We don't know the value of sleep. We don't know exactly how much sleep we need. We mistakenly think we can achieve more if we sleep less. Underestimating sleep ""There are three pillars of good health: proper nutrition, regular exercise and sufficient amounts of quality sleep,"" Selecky said. Many know this but continue to treat sleep like Rodney Dangerfield: getting ""no respect."" Sleep experts estimate that most American adults need a minimum of eight hours of sleep a night to function properly. Yet, a National Sleep Foundation poll found that one-third of Americans 18 years and older sleep 6.5 hours or less nightly during the work week. About 45 percent said they sleep less in order to accomplish more. Sleep is such a basic powerful need that our minds and bodies at times will override our decision to stay awake. ""The need to sleep is as strong as the drive to breathe, to eat and to reproduce,"" said Dr. Peter Fotinakes, medical director at UCI Medical Center's Sleep Disorders Center. Think about those times when you drove your car on the freeway despite feeling extremely tired. You know that falling asleep at the wheel could cost you your life, yet you were unable to stop yourself from closing your eyes and dozing for a few seconds. How much is enough? Sometimes we don't get enough sleep because we don't realize how much we need. Although eight hours of sleep is the minimum most need, it's not a hard and fast rule. ""Every person's sleep needs are different,"" Fotinakes said. ""You have to listen to your body."" Here's how you can find out how much sleep you need, according to sleep specialist Dr. William Dement in his book ""The Promise of Sleep,"" (Dell Trade, $14.95): Let's say you think you need eight hours. Here's what to do: Pick a time when you think you can fall asleep easily. Set your alarm clock for eight hours and 15 minutes later. The 15 minutes is a rough estimate of the time it will take for you to fall asleep. Follow this routine for several days; observe and record in a sleep diary your level of alertness or sleepiness throughout the day. Keep track of your tendency to fall asleep while watching TV or reading a book. If you find that you are consistently sleepy and tired, you may need more sleep. Add 30 minutes to your sleep time and keep monitoring. If both your tendency to become drowsy and fall asleep declines, this means you are paying off your sleep debt. When your tendency to become drowsy and fall asleep stays the same, the amount of sleep you are getting is what you need or close to it. The price of not getting enough sleep In some circles, being able to get by on little sleep is often misconstrued as a superhuman ability -- something worth bragging about. Somehow, more waking hours translate into more hours for activity, particularly work. But we pay for that lack of sleep, especially at work. ""I need eight hours to feel my best the next day,"" said Chao, the doughnut-shop manager. ""Otherwise, I'm not as alert or quick to respond. I also get a little cranky sometimes."" At least two-thirds of adults say that sleepiness makes concentrating and handling stress on the job more difficult, according to the NSF poll. More than half say that decision-making and problem-solving are more difficult when they are sleepy. They say the quality and quantity of their work are diminished when they are sleepy. The negative effects of sleep debt hit shift workers the hardest, according to the poll. Driving while drowsy can be as hazardous as driving drunk, according to a report in the Journal of the American Medical Association this year. One of Fotinakes' patients, a 19-year old man, fell asleep at the wheel, got into an accident and temporarily lost his license. He was thought to have narcolepsy, a sleep disorder in which people fall asleep at inappropriate times. But after an examination, Fotinakes found that the man had a severe case of sleep debt. ""He had a job, he went to college, he was volunteering at his church,"" Fotinakes said. ""His average day lasted probably 18 hours."" E-mail: lisa_liddane@link.freedom.com Call: (714) 796-7854 'zzzzzzz your Illustration by ANDREW LUCAS The Orange County Register Illustration Caption: HOW SLEEPY ARE YOU? (CHART-LIST)TIPS FOR A GOODNIGHT SLEEP (CHART-LIST) Credit: Story by The Orange County Register  People: Selecky, Paul Chao, Lily Fotinakes, Peter ",2000,"Orange County Register; Santa Ana, Calif."
"12425",12425," Scientists still know very little about what sleep really is, or what it accomplishes on a molecular level. Researchers reported in June that sleep helps rid the brain of a chemical called adenosine that builds up during wakeful hours, but no one knows why adenosine must be eliminated, or what other brain chemicals may contribute to the subjective feelings of sleepiness or mental exhaustion. How much sleep is enough? The answer varies from person to person. ""Some people can get by with 4 1/2 hours, and others really need nine,"" said Ronald Dahl, director of the child and adolescent sleep laboratory at the University of Pittsburgh Medical Center. In addition, people differ in terms of the time of day in which they function best; some have no problem getting up early in the morning, while others are inexplicably but unquestionably night people and look upon dawn with Dracula-like dread. Sleep researchers refer to them as ""larks"" and ""owls."" Keeping those variations in mind, experts said, the following rules are generally true: * Full-term newborns need to sleep about two-thirds of the time, or about 18 hours a day. * Toddlers and young children need about 12 hours a day, some of which may be taken in naps. * Youngsters from about 8 up to the late teens need 8 1/4 to 9 1/4 hours of sleep a night, with older teens generally needing to fall asleep a little later and so needing to sleep a little longer in the morning. * Adults given the opportunity to sleep as much as they want in a laboratory setting that includes 14 hours of darkness each day often take the full 14 hours at first, then scale back, apparently having caught up with overdue sleep. Ultimately, they reach an equilibrium that includes about 8 1/4 hours of sleep each night. * Older adults typically get less sleep than that, perhaps because of an age-related decline in melatonin, the brain hormone that helps induce sleep. But it's not known whether they'd feel better if they got more than that. PHOTO: (Clock) Credit: THE WASHINGTON POST ",1997,"Los Angeles Times; Los Angeles, Calif."
